{
  "approval_id": "approval_20260627_memory_write",
  "task_id": "task_20260627_001",
  "proof_id": "proof_20260627_001",
  "action": "memory_write",
  "actor": {
    "type": "human",
    "id": "@yet:notyet.local"
  },
  "target": {
    "type": "memory_proposal",
    "proposal_id": "memory_proposal_20260627_001",
    "memory_scope": "codex/carpet/phase8"
  },
  "conditions": [
    "Write only the memory proposal that cites this proof."
  ],
  "created_at": "2026-06-27T04:24:00Z",
  "expires_at": "2026-06-27T06:24:00Z"
}
