{
  "approval_id": "approval_20260627_secret_access",
  "task_id": "task_20260627_001",
  "proof_id": "proof_20260627_001",
  "action": "secret_access",
  "actor": {
    "type": "human",
    "id": "@yet:notyet.local"
  },
  "target": {
    "type": "secret",
    "secret_ref": "secret://github/app-token",
    "purpose": "Create the approved PR for this proof."
  },
  "conditions": [
    "Secret access is limited to the approved action and expires with this approval."
  ],
  "created_at": "2026-06-27T04:23:00Z",
  "expires_at": "2026-06-27T06:23:00Z"
}
