{
  "approval_id": "approval_20260627_push_branch",
  "task_id": "task_20260627_001",
  "proof_id": "proof_20260627_001",
  "action": "push_branch",
  "actor": {
    "type": "human",
    "id": "@yet:notyet.local"
  },
  "target": {
    "type": "git_branch",
    "ref": "refs/heads/analysis/p8-approval-gate-contract"
  },
  "conditions": [
    "Only push the reviewed task branch for this proof."
  ],
  "created_at": "2026-06-27T04:20:00Z",
  "expires_at": "2026-06-27T06:20:00Z"
}
